<?xml version="1.0" encoding="UTF-8"?>
<Persons xmlns:xsi="http://www.w3.org/2001/XMLSchema-instance"
         xsi:schemaLocation="myNamespace Persons.xsd"
         xmlns="myNamespace">
    <Person nickName="bayernkraft.by">
        <Email>bmw.service@bayernkraft.by</Email>
        <Password>bayernkraft</Password>
        <Address>г. Минск, ул. Панченко, 9</Address>
        <PhoneNumber>+375447730077</PhoneNumber>
        <Brand>
            <Title>BMW</Title>
            <Model>
                <Name>7 series</Name>
                <Class>Седан</Class>
                <Price>164400</Price>
                <Years>2018</Years>
            </Model>
            <Model>
                <Name>X6</Name>
                <Class>Кроссовер</Class>
                <Price>132000</Price>
                <Years>2018</Years>
            </Model>
        </Brand>
    </Person>

    <Person nickName="mercedes-benz.by">
        <Email>info@mercedes-benz.by</Email>
        <Password>mercedes</Password>
        <Address>г. Минск, ул. Тимирязева, 70</Address>
        <PhoneNumber>+375296039999</PhoneNumber>
        <Brand>
            <Title>Mercedes-Benz</Title>
            <Model>
                <Name>E 200 4MATIC</Name>
                <Class>Седан</Class>
                <Price>137706</Price>
                <Years>2018</Years>
            </Model>
            <Model>
                <Name>GLS</Name>
                <Class>Внедорожник</Class>
                <Price>164700</Price>
                <Years>2018</Years>
            </Model>
        </Brand>
    </Person>
</Persons>